{
  "product_master_id": "pm-example-1",
  "product_version_id": "pv-example-1",
  "brand": "PM-Extra",
  "manufacturer": "Example Corp Pharmaceuticals",
  "standard_name": "PM-Extra Paracetamol 500mg Tablets",
  "generic_name": "Paracetamol",
  "dosage_form": "tablet",
  "active_ingredients": [
    {
      "name": "Paracetamol",
      "per_unit_dose": "500",
      "per_unit_dose_unit": "mg",
      "original_per_unit_dose": "500mg"
    }
  ],
  "package_quantity": "30",
  "package_description": "30 tablets per bottle, 1 bottle per box",
  "region": "CN",
  "registration_id": "Guo Yao Zhun Zi H12345678",
  "registration_jurisdiction": "CN",
  "registration_type": "drug_approval",
  "source_ids": ["tmall-20250620-001", "official-20250620-001", "jd-20250620-001"],
  "data_quality_score": "high",
  "identity_certainty": "confirmed",
  "record_version": 1,
  "record_version_note": "Initial product record created from 3 source listings."
}
